{
  "schema_version": 1,
  "id": "sc2-gap-report-roles",
  "statement": "The earlier 0x45-primary inference cannot be applied to wired 2026 traffic; the independent dissector distinguishes 0x42 from BLE-oriented 0x45, but physical mode-specific prevalence is unverified.",
  "status": "inferred",
  "applicability": {
    "controller": "steam-controller-2026",
    "revision": "not measured",
    "firmware": "not measured",
    "transport": "source_only",
    "scope": "Source-only hypothesis; source definitions are not physical or live consumer confirmation."
  },
  "sources": [
    "sc2",
    "sc2-src-dissector"
  ],
  "experiments": [],
  "conflicts_with": [],
  "supersedes": [],
  "rejection_scope": null
}
