{
  "schema_version": 1,
  "id": "sc2-july-puck-input-79",
  "statement": "Capture-recorded official Puck connection lifecycle report 0x79 at 2 wire bytes (1 body), including two events in stopped-Puck disconnect/reconnect window and targeted active retry where body 01 indicated disconnect, then 02 reconnect. Source-only Linux/SDL 0x79 state roles agree; timing, slot addressing and four-device fidelity remain unverified.",
  "status": "source_supported",
  "applicability": {
    "controller": "steam-controller-2026-puck",
    "revision": "operator notes: July–August 2026; hardware revision unrecorded",
    "firmware": "not recorded",
    "transport": "receiver",
    "scope": "Operator notes §6–8; actual event bodies only 01 and 02."
  },
  "sources": [
    "sc2-src-capture-notes-2026",
    "steam-ibex-linux-driver",
    "steam-triton-sdl-driver"
  ],
  "experiments": [
    "sc2-exp-puck-steam-stopped-20260731",
    "sc2-exp-puck-steam-active-20260803"
  ],
  "conflicts_with": [],
  "supersedes": [],
  "rejection_scope": null
}
