{
  "schema_version": 1,
  "id": "sc2-gap-host-output-capture",
  "statement": "The Steam-active haptics/audio experiment lacks the host-to-device USB output trace needed to attribute emitted feedback to reports and feature commands.",
  "status": "unknown",
  "applicability": {
    "controller": "steam-controller-2026",
    "revision": "not measured",
    "firmware": "not measured",
    "transport": "usb",
    "scope": "Evidence gap only; source and physical requirements described in docs/steam-controller-2026-research-gaps.md."
  },
  "sources": [],
  "experiments": [],
  "conflicts_with": [],
  "supersedes": [],
  "rejection_scope": null
}
